{
  "schema": "fusiondigital.blender-publish-job.v1",
  "jobId": "example-device-publication",
  "artifactId": "design.example-device",
  "label": "Example device visualization asset",
  "source": {
    "path": "../../private-input/example-device.glb",
    "sha256": "0000000000000000000000000000000000000000000000000000000000000000",
    "format": "glb"
  },
  "outputRoot": "../../build/visualization/example-device",
  "authority": "synthetic",
  "classification": "internal",
  "clientDownloadAllowed": true,
  "coordinates": {
    "units": "m",
    "upAxis": "Z",
    "handedness": "right",
    "frame": "plant"
  },
  "sourceRecord": {
    "kind": "design-asset",
    "id": "example-device-source"
  },
  "deliveries": [
    { "profile": "web-mesh", "format": "glb", "path": "web/example-device.glb" },
    { "profile": "openusd", "format": "usdc", "path": "usd/example-device.usdc" }
  ],
  "options": {
    "requireStableIds": false,
    "applyModifiers": true,
    "exportMaterials": true
  }
}
